"rpid","oid","mid","name","level","datetime","content","like","rcount"
"1705131496","54916636","611975","滋补的骆驼","6","2019-06-23 00:25:53","我崩三氪了几万，你就做出这狗屁玩意？[小电视_差评]","0","0"
"1705132254","54916636","3769925","古驰G1A0","6","2019-06-23 00:26:44","米 卫兵你洗尼emoji呢？","2","0"
"1705137174","54916636","14622974","山楂饼_SAZABI","6","2019-06-23 00:29:32","米哈游三百年文化浓缩起来就是抄袭文化，抄袭文化就是原神，读懂了原神就读懂了抄袭。
原神文化就是拼搏进取，不屈不挠，永不言败，尤其是乐观向上
我做原神，从它的画风到他的玩法，我太了解他了，它才是中国第一代抄袭之王。我的原神带制作下半年就要发售了，明年就会上架，大家多多支持。
我还看过哪部塞尔达里，林克的画风这样做的，一点二刺螈风都没有，那不成了写实风了，应该这样抄，老任，走诶。               
  路上就有几个小朋友问我，米哈游叔叔，原神有多少原创啊?
原神需要抄袭，看到塞尔达上下打量一番，我能抄袭多久，我用什么方法来“借鉴”他。总不能我一看这个林克“太漂亮啦～”，我是不是可以和任天堂购买版权，这我没法搞。游戏历史上从来不缺乏可歌可泣的原创故事，希望可以给原神留下一片抄袭的净土
我还看过我们现在的一些游戏作品，鬼泣和猎天使魔女都谈起恋爱来了,但丁叫贝姐叫贝贝，贝姐叫但丁叫丁丁，动作不分是非颠倒，有意思吗?甚至把原神变成中国原创的游戏，这是非常要不得的，那不是我们中国民族子孙后代要做的事情。
像这样一个垃圾抄袭，世界烂游，如果如此恶搞，那么这些游戏、周边的主创人员、制作人需要向本国人民谢罪的。
原神文化就是拼搏进取，不屈不挠，永不言败，尤其是乐观向上。
一千个人心中有一千个哈姆雷特，一万个人心中只有一个原神。
原神抄袭荒野之息弘扬的是喜剧剧情的真善美，抨击的是塞尔达没有萌豚人设的假恶丑恶
由我制作的大型3D移动游戏《原神》，我在其中扮演塞尔达和林克。
大家好，我是米哈游，是手游《原神》的首席文化大使，一朝抄袭，一生抄袭，演绎混蛋几十载，智斗加农现神通，百般洗白样样有，借鉴任天堂，重温白金卡普空，感受不一样的二刺螈文化，我等着你。
我上次出国，海关把我拦住了，看着我的身份证对我说：你这身份证是假的吧？ 我说是真的啊！他说：你不是叫米哈游吗？   所以我有两张身份证，一张是米哈游，一张是任哈游，不是特权，是工作需要。  刚才进场的时候还有叫我米忽悠老师的","4","2"
"1705152040","54916636","4525794","Sh0wMaKer-","6","2019-06-23 00:35:43","吵得这么凶真是给这游戏打了一波好广告，米哈游又能恰好大一波路人手游玩家的??","0","0"
"1705235861","54916636","21525274","丶棠诗","5","2019-06-23 01:09:43","咋就那么喜欢对线","0","0"
"1705233959","54916636","300879190","简隐大佐","3","2019-06-23 01:14:25","米卫兵是真的蠢，这种明显的抄都要洗，要么就拉着大家一起下水，抄袭作主机玩家未必玩少了？你硬要洗个锤子的地呢？","1","8"
"1705258417","54916636","65429360","来看直播咯","5","2019-06-23 01:24:48","这sm米哈游真让人恶心 亏我原来还觉得崩崩崩不错然后充了128呢","2","0"
"1705280888","54916636","287811147","小火轮滴溜溜","5","2019-06-23 01:35:08","出于对荒野之息的热爱，这两天在心里无数遍咒骂这刷新下限的粪作，诅咒某些三观low爆等着给这游戏充钱滋润的人。
我现在还会想起海拉鲁大陆翻滚的云海、风吹草低的平原、层染落日余晖的山坡，哪怕是暴雨的野外、寂寥的雪山、荒凉的戈壁与沙漠。我所有出生入死的冒险，所有温暖、伤感的伙伴与羁绊。我从来没有像玩荒野之息的时候那样，希望自己真的可以活在那个世界里。我做不到，所以我所有在那个世界里的见闻与冒险，至今仍是我宝贵的回忆。
没玩过荒野之息的人，一定难以想象我们看到这山寨货的时候的愤怒。
你们看PV和实测的时候所感受到的惊艳与美好，远远不及塞尔达荒野之息的百分之一。难以想象？夸大其词？你没见过，我也难以解释。
我恨不得这企划就此腰斩，米哈游及其背后资本投入的钱付诸东流，要是始作俑者和开发团队能够遭遇些什么事故的话，我可能会很高兴。
不为什么国产未来，就只是为对自己心中的神作的亵渎而生气。
还原神作？开个玩笑而已，你够格吗？[微笑]","4","1"
"1705299501","54916636","272046832","莫奈wz","4","2019-06-23 01:51:41","我只希望一点，原神出来的时候，希望你们这些塞尔达玩家不要来挤服务器啊，喷子你也别来，我怕一套皮肤下去，大伟哥做梦都会被笑醒。(=?ω?=)","0","8"
"1705351765","54916636","25100212","WilliamArrow","6","2019-06-23 02:32:23","怎么还有喷二次元的，塞尔达就不是二次元吗？你们喷米哈游啊，顺便贬低一下二次元有意思嗷。什么你说游戏就不是二次元，神奇宝贝呢？","5","1"
"1705360023","54916636","25100212","WilliamArrow","6","2019-06-23 02:41:28","看了原神的一测，在这么有限的时间是怎么做出那么多的地图和元素的？我也玩崩三，但真的受不了无脑洗啊。","2","3"
"1705370894","54916636","25100212","WilliamArrow","6","2019-06-23 02:49:31","你们喷米哈游就好了，放什么地图炮？放地图炮的你们样子像极了米哈游。","2","0"
"1705372099","54916636","23746974","-网络豹力-","5","2019-06-23 02:54:58","为什么人们疯狂输出在评论区？
为什么我们痛骂崩小将偏安一隅？
从崩坏学园
到休伯利安
再到现在的元神传说
所谓的技术宅拯救世界
只是吸着氪金母猪的乃子不思进取
我们不想看到恰饭视频成为常态
我们的心中尚且怀有期待
天下熙熙，皆为利来
天下攘攘，皆为利往
从事服务性行业还要立纪念性建筑
mhy的心中究竟有没有b数？
因为心中仍然抱有期望，我们在********评论区口吐芬芳
而那些人的无脑护才是真正在葬送还未升起的国产之光。","2","2"
"1705382269","54916636","8619186","现役单身勇者","6","2019-06-23 03:04:43","没有原神塞尔达能这么火?
我steam1000小时塞尔达都不敢说是抄袭哦[滑稽]","0","4"
"1705384105","54916636","6865478","乐扣桑","6","2019-06-23 03:11:04","关键是你不能喷这游戏是坨屎，因为以塞尔达为原型怎么着都不会是坨屎","2","2"
"1705392692","54916636","77681744","啊fie","5","2019-06-23 03:24:39","以前:国内玩家日益增长的游戏文化需要同落后的业界产出之间的矛盾。
现在:玩家日益增长的美好游戏需要和国内业界不进步不创新的产出之间的矛盾。[doge]","0","0"
"1705398037","54916636","2358713","旭月Thirteen","6","2019-06-23 03:26:26","今天就在贴吧里看到有米卫兵说塞尔达是没有原创玩法的，塞尔达原创的是画面和剧情，开放世界和迷宫解谜玩法早十年二十年就有了，现在米卫兵都开始贬低塞尔达来拯救原神的口碑，我也是笑了，不愧是米忽悠，能吧米卫兵忽悠成傻子也是挺厉害的。","0","0"
"1705401667","54916636","77681744","啊fie","5","2019-06-23 03:42:50","别的不说，这游戏光出皮肤卖都能大赚特赚[小电视_嘟嘴]","1","0"
"1705418201","54916636","37539211","阿卡迪斯亚","5","2019-06-23 04:18:58","这玩意用手机可以带的起？","0","0"
"1705448801","54916636","8618915","弗洛伊德之怒","5","2019-06-23 05:43:16","我看够各种抄袭言论了!原神抄袭了塞尔达你们再抄袭原神不久行了？这TM才叫解气！","0","0"
"1705453537","54916636","5975168","圆环-","6","2019-06-23 06:09:31","给??整点新的洗地方式乐一乐，都是这些没看头没水准","3","1"
"1705454856","54916636","3326166","熟食君","6","2019-06-23 06:21:30","唉。。","0","0"
"1705485859","54916636","34171106","消失也存在","5","2019-06-23 06:50:14","av55196335","0","0"
"1705507063","54916636","86439211","没有人性的不死人","6","2019-06-23 07:26:21","如果真做得和荒野之息一样，我可能还带不动( ′_ゝ｀)","0","0"
"1705523769","54916636","65471884","bili_65471884","5","2019-06-23 07:44:16","脸都不要了，恶心","0","0"
"1705541321","54916636","22037474","弦年Ahren","6","2019-06-23 07:51:47","1660ti请求一战","0","0"
"1705548077","54916636","31999894","8BitVaporwave","5","2019-06-23 08:05:38","先把抄袭的b站卸载了去知乎高谈阔论，笑死[2233娘_大笑]","0","0"
"1705585535","54916636","85321489","皮鞋味的果冻","5","2019-06-23 08:23:21","麒麟980与之一战","0","0"
"1705582830","54916636","179767659","白夜梦G","5","2019-06-23 08:28:21","这几天网上都在说原神的事，我说说我的看法。
1.原神的确与赛尔达十分相似，角色动作也有与其他游戏相同的地方，但在法律上，抄袭与借鉴的定义本来就很模糊，到底抄没抄等游戏公测后任天堂方面的反应再说，网上吵的再凶也没有意义。
2.原神的制作确实不错，就目前一测来看，优秀的人物建模依旧延续了米哈游一贯的风格，游戏的剧情CG也很不错，玩法与动作先不去讨论，游戏一但问世我想火是一定的。（毕竟你们吵的都快全网都知道了）[无语]
3.虽然现在网上说抄袭的很多，但洗米的也不少（其实大部分都是水军，跟风的只小部分），但最后的受益者只会是米哈游，毕竟只要任天堂方面没有动作，公测时将游戏改一下改（测试品与成品没有可比性），该玩的玩家还是去玩，路人玩家也会闻迅而来，结局就是米哈游成最大赢家。
最后总结一下，大家不要去带节奏，洗米的也不要洗了，那样只会更加招黑。（水军请继续，毕竟拿了软妹币）","2","0"
"1705590556","54916636","15191730","凡绘","6","2019-06-23 08:32:01","你以为原神全抄了塞尔达？？？原神可不仅仅抄了塞尔达啊，米卫兵不要洗了，游戏里面我也看过了，攻击的方式，滑翔翼，解谜玩法，路面野怪判定机制，元素与场景，不说全抄也是雷同，尤其是最后一项，确实就是塞尔达的特色","2","0"
"1705615336","54916636","57106624","LetsRollOut","5","2019-06-23 08:42:56","不如崩三","0","0"
"1705639232","54916636","13571937","听说你叫潮汐","6","2019-06-23 09:05:42","这踏马不是抄袭 这是能照搬的都是照搬了 这摆明了是照着续作去做的  想小三变正统  顺便也移植了PC平台  过不了多久就会改名塞尔达1.5PC版","0","0"
"1705666362","54916636","17962872","只狐丶嘤逝二度","6","2019-06-23 09:17:11","我在想这是魔法世界，为什么不全做魔法世界该有的样子，而是要用武器战斗呢？你当这是alo吗。而且可以做到魔法飞行吧，有必要去拿道具飞行吗，游水跑步都可以运用魔法啊，为什么偏偏要用脚跑步用身体去游水呢。这是在魔法世界当中啊。
想法都不新颖，还怎么原创呢。","4","2"
"1705667679","54916636","293108450","FIIXD","3","2019-06-23 09:19:14","支持花粥","2","0"
"1705681550","54916636","5184770","龙从长","6","2019-06-23 09:24:23","要说专利 早期大厂都有狠专利那后面的公司别做游戏了[2233娘_大笑]","0","0"
"1705682734","54916636","36123869","绝水月刀","5","2019-06-23 09:26:02","看了一下游戏的直播演示，我觉得我真是高估了米哈游了。抄袭也是要本事的，米哈游连个皮毛都没学到，说抄袭都是在夸它。等游戏出来以后，抄袭不成立，米卫兵估计又要口嗨了。","0","0"
"1705683171","54916636","82190782","尼古拉斯凯奇派大星","4","2019-06-23 09:26:37","地图都和塞尔达一模一样","0","0"
"1705720830","54916636","293108450","FIIXD","3","2019-06-23 09:39:38","支持错了 支持米哈游","0","0"
"1705731952","54916636","166647636","松华bear","5","2019-06-23 09:48:31","我没有ns，有个手游版的塞尔达我还挺高兴的！","0","0"
"1705740879","54916636","46337659","余晖宇辉","6","2019-06-23 09:49:50","400块的塞尔达这仅仅是游戏还有主机  ……其中还包括破解主机 以及破解模拟器  讲道理国内的正版的塞尔达真的很少……原神评论区突然炸出一个b站的塞尔达玩家？","0","4"
"1705753220","54916636","1627753","甜茶酒酿","6","2019-06-23 09:57:29","为什么会出现米卫兵这种东西啊(-_-#)","0","0"
"1705883339","54916636","51761245","萌萌的圣骑吃米皮丶踢","4","2019-06-23 10:52:10","游戏玩法都不一样

原神现阶段除了野外探索，地下城副本，剧情跑图，摸鱼看风景。

最核心的玩法是元素的组合搭配与融合，目前已知:

风+任意元素=扩散
雷+水=感电
火+冰=融化
雷+火=过载
水+火=蒸发
冰+水=冻结
草+火=燃烧
冰+雷=超导

更别说以后还要上线的联机交互系统，组队系统，家园，羁绊，收集，未开放的七大主城。

原神属于前期开荒较慢，但越往后玩，元素越多，越好玩的类型。现在单单就开了个“序章”，然而这个新手村你没个15小时还走不出来。

抄袭的界定本来就模糊，国内的环境也真的有问题，国内抄袭，国外致敬?为什么版权意识更好的国外好评率居多?国人更有甚者，专门跑到国外去黑自家东西，我也算是见识到了。

老任当初就已经公布了塞的流程，也有专利，却从未收取，意思就是告诫你们后来游戏制作者:“看，这就是标杆，当你们不知道怎么做时，可以跟着我们的脚步来做游戏，来丰富整个游戏界的内容，我们鼓励你们这样做。”，况且当初米忽悠招人的时候也明确提到画风渲染为塞尔达画风。

节奏党要真要追究，那么手机上几乎所有的游戏都能在先于手机的平台上找到所谓的“起源”，QQ也是“抄袭”，淘宝也是，甚至你们整天发表言论的b站的运营模式也是“抄袭”，那不咱先把手机APP卸载，顺便退个站?

另一边喜欢原神的小伙伴也不要言语过激，这次事件后肯定有人推波助澜，况且pv本来就是碰瓷营销炒热度，不要吵，假如别人跟你理论，那么你就邀请他玩一玩原神，真正玩过的人就知道，节奏的言语是多么的苍白。

希望双方都理智一点，言语上的不训，除了败坏环境，挑起争端以外，得不到任何好处。若原神真的有问题，事情闹的这么大，任会管，但我觉得他们的态度更偏向于一个前辈看后来者成长的态度，以一个长辈的姿态去鼓励小辈的成长，而不是某些人所扭曲的扼杀于摇篮。

说了这么多，还是邀请你们等原神上线后自己真正地去感受一下这游戏带来的体验，这对于现在的手游来说绝对是一场精彩的盛宴。因为原神将会成为手机里的一个世界，这质量不比玩“换皮游戏”开心得多?

（希望真正喜欢游戏的伙伴们复制转发一下，望周知，望和解，望游戏者们莫要忘记，游戏本来的目的，就是为了给我们带来快乐！）","1","0"
"1705906161","54916636","26129243","我承受着不该有的智慧","6","2019-06-23 11:01:40","反正塞尔达续作要出了，坐等续作","0","0"
"1705949537","54916636","293108450","FIIXD","3","2019-06-23 11:19:09","只有宣传pv涉嫌抄袭时：现在喷是不是太早了？你玩过吗就说是抄袭？
实播锤定内容时：抄就抄了，任天堂都没说什么你急什么？
这口风变得真快啊（滑稽）","6","0"
"1705962543","54916636","180017765","落寞寂典","5","2019-06-23 11:22:55","所以呢，什么时候出，太晚了我直接买塞尔达了[嫌弃]","0","0"
"1705983074","54916636","181798720","布兰奇QAQ","5","2019-06-23 11:31:11","为啥要抄袭啊，米忽悠又不是没有本事去做原创游戏，抄袭真的败坏游戏声誉[2233娘_汗]","2","2"
"1706007150","54916636","57899391","梦淮菌","6","2019-06-23 11:40:27","一个个上来就骂别人米太君，b站素质可真好","1","0"
"1706020945","54916636","1315075","爱在七元钱","6","2019-06-23 11:44:38","这是什么游戏啊，
第一眼看上去好像
。
。
。
。
。
次元守望啊[蛆音娘_滑稽]","0","0"
"1706040237","54916636","432735730","一颗老西瓜-","5","2019-06-23 11:50:55","欸嘿，老子可不是中立的理性机器，你们和个傻子一样去洗这个破游戏还费力装作理智的样子像个傻*逼，
抄袭就是抄袭，就这还洗，评论区举得几个点，给的视频洗的，避重就轻，说了几个所有游戏光影的通用点意思就是我牛逼游戏不是抄袭的了？
真的丢人，丢你们父母的人，连个承认事实都做不到，和个孩子一样在哪里狡辩，你知道明眼人看你们的眼神和个小丑一样吗？还以为别人挺重视你们的，哈哈哈笑死我了
对了，根据中国国家网络研究中心发布的21018年12月份的调查报告，在全国网民中本科及以上学历所占人数不超过8.9%，超过40.44%的网民学历在初中及以下分布","4","1"
"1706099244","54916636","188733203","德尔塔派蒙","5","2019-06-23 12:15:09","欢迎来到哔哩哔哩PVP评论网","2","1"
"1706107713","54916636","4755787","Ire1ia","5","2019-06-23 12:17:20","这游戏给??逗乐了 还看到有个几百小时老玩家洗 真是游戏玩多了 脑子都么得了嗷","2","2"
"1706104422","54916636","288596026","Ereat","5","2019-06-23 12:17:36","与借鉴的区别
根据《现代汉语词典》的解释：抄袭是把别人的文章、作品私自照抄作为自己的去发表；借鉴是与别的人或事相对照，以便取长补短或吸取教训。【3】区别在于前者是“照样抄录”，后者是“参考仿照。——摘自百度百科
顺带一提，来看看吧：http://www.uisdc.com/define-reference-cop","0","0"
"1706140329","54916636","11889017","梧桐本栖凰","5","2019-06-23 12:26:11","米卫兵和任豚都在被当猴耍，老任无所谓，米忽悠笑哈哈，一帮弱智帮我免费打广告提热度，这才一测，原神国内国外宣传都不一样，到时敏感东西一改，游戏质量到位没抄啥，你们不傻眼？真是被人卖了还帮别人数钱[响指]","1","0"
"1706136945","54916636","155569738","离谱之人干寻常之事","6","2019-06-23 12:26:27","游戏玩法都不一样

原神现阶段除了野外探索，地下城副本，剧情跑图，摸鱼看风景。

最核心的玩法是元素的组合搭配与融合，目前已知:

风+任意元素=扩散
雷+水=感电
火+冰=融化
雷+火=过载
水+火=蒸发
冰+水=冻结
草+火=燃烧
冰+雷=超导

更别说以后还要上线的联机交互系统，组队系统，家园，羁绊，收集，未开放的七大主城。

原神属于前期开荒较慢，但越往后玩，元素越多，越好玩的类型。现在单单就开了个“序章”，然而这个新手村你没个15小时还走不出来。

抄袭的界定本来就模糊，国内的环境也真的有问题，国内抄袭，国外致敬?为什么版权意识更好的国外好评率居多?国人更有甚者，专门跑到国外去黑自家东西，我也算是见识到了。

老任当初就已经公布了塞的流程，也有专利，却从未收取，意思就是告诫你们后来游戏制作者:“看，这就是标杆，当你们不知道怎么做时，可以跟着我们的脚步来做游戏，来丰富整个游戏界的内容，我们鼓励你们这样做。”，况且当初米忽悠招人的时候也明确提到画风渲染为塞尔达画风。

节奏党要真要追究，那么手机上几乎所有的游戏都能在先于手机的平台上找到所谓的“起源”，QQ也是“抄袭”，淘宝也是，甚至你们整天发表言论的b站的运营模式也是“抄袭”，那不咱先把手机APP卸载，顺便退个站?

另一边喜欢原神的小伙伴也不要言语过激，这次事件后肯定有人推波助澜，况且pv本来就是碰瓷营销炒热度，不要吵，假如别人跟你理论，那么你就邀请他玩一玩原神，真正玩过的人就知道，节奏的言语是多么的苍白。

希望双方都理智一点，言语上的不训，除了败坏环境，挑起争端以外，得不到任何好处。若原神真的有问题，事情闹的这么大，任会管，但我觉得他们的态度更偏向于一个前辈看后来者成长的态度，以一个长辈的姿态去鼓励小辈的成长，而不是某些人所扭曲的扼杀于摇篮。

说了这么多，还是邀请你们等原神上线后自己真正地去感受一下这游戏带来的体验，这对于现在的手游来说绝对是一场精彩的盛宴。因为原神将会成为手机里的一个世界，这质量不比玩“换皮游戏”开心得多?

（希望真正喜欢游戏的伙伴们复制转发一下，望周知，望和解，望游戏者们莫要忘记，游戏本来的目的，就是为了给我们带来快乐！）","2","1"
"1706132281","54916636","11579994","治疗设备真是先进","6","2019-06-23 12:26:28","这要是腾讯出的游戏怕是被喷出翔。
什么？二次元游戏，那没事了。","2","1"
"1706132971","54916636","35958410","二十号机器人","5","2019-06-23 12:27:14","那么，在哪里下载呢？","0","0"
"1706187154","54916636","1376989","冬末-","5","2019-06-23 12:43:50","劳资塞尔达还真tm是万物起源，还有什么刺客信条告塞尔达，笑死了，初代刺客是07年发售，人家青沼英二、宫本茂哪个不是游戏界活化石？可能你们新生代手游玩家没有体会过什么叫游戏史的发展，马里奥对平台跳跃的贡献，塞尔达对游戏存档的贡献，马64和时之笛对3d游戏的贡献，人家青沼英二在gdc教其他开发者怎么做游戏。我们这一堆人玩个缝合要素手游玩出优越感，得出结论“管他抄不抄，好玩就行”我们这其他独立游戏开发者辛苦创意制作的游戏无人问津，借鉴要素过于明显的手游反而大受欢迎，这就会导致恶性循环，既然创意可以从别人那拿，那为什么要费劲自己思考怎么做好玩的游戏，至今天朝游戏出名的还是那几个ip，还有米卫兵这帮子人除了水军以外，明显就是国内畸形游戏市场惯坏的孩子， 一个游戏的gameplay，不单只有美术层面，大家都照搬国外成功的游戏素材和创意，不用担心侵权照样转的盆满，就算你嫖了，如果你能做出自己的东西，再官宣下致敬，我举个例子，以撒的结合 这个游戏为什么没人说抄袭塞尔达传说呢 因为作者自己就说了是致敬塞尔达传说制作 而且加入了roglike要素，游戏过程，美术什么都完全没有照搬他致敬的目标 做出自己的东西，那大家都喜欢 还有人说怎么国外致敬就不是抄袭，我们国产就抄袭 。国产也有厉害的原创手游啊，为啥就喷他米哈游呢 这游戏从宣传到测试都在蹭热度，当然也不排除米哈游就是要达到这个宣传的目的，利用旷野之息免费帮自己宣传一波，但是这方式就属于恶臭的那种 争议才会引来更多流量。","2","0"
"1706239745","54916636","39498394","ZY?_?","6","2019-06-23 13:03:40","你这可不只是玩法抄袭了哦哈哈哈，换皮游戏牛逼呢，我可玩不起这种游戏","2","0"
"1706311275","54916636","15676621","取名字是最烦的","5","2019-06-23 13:27:57","没玩到塞尔达的当然觉得原神好玩咯，吃不起巧克力吃代可可脂也是甜的呀。","0","0"
"1706325671","54916636","108599985","意中人是傲娇怪","5","2019-06-23 13:32:46","看大家互喷的那么嗨，我想问一下游戏出来你们会玩吗？[2233娘_喝水]","0","1"
"1706344694","54916636","66663235","滑县第六精神病院","5","2019-06-23 13:41:38","我是崩坏系列玩家，认真的，建议别碰原神这个游戏，就让他凉，我们这些玩家光是喷，锤，不真正拿出态度的话仍旧什么都改变不了，我没玩过多少主机，也没玩过塞达尔，所以关于抄袭我不发表意见，但是如果我们能坚决抵制国内游戏抄袭行为(必须是实锤了的那种)，让每一个抄袭者都血本无归，用自己的行动来表态，而不是等着被抄袭的受害者律师函怎样怎样，想必中国国产游戏一定不是在沉默中死亡，就是在沉默中爆发！(可是，我太理想化了是么......这两天看到关于原神的东西就头疼，看到评论里有人替mhy说话我也会觉得轻松一些，但是我没有了解的东西我不敢去评辩是非，只能发出这种无力的呼吁了)","2","0"
